{
  "schema_version": "1.0",
  "version": "2026-06-08-initial",
  "description": "Initial runtime ontology manifest for retrieval expansion and Graph Planner lexicon.",
  "concepts": [
    {
      "concept_id": "cov.indemnity_medical",
      "canonical_name": "실손",
      "node_type": "CoverageItem",
      "aliases": ["실손", "실비", "실손보험", "실손의료보험"],
      "planner": {"coverage_topics": ["실손"]}
    },
    {
      "concept_id": "cov.rider",
      "canonical_name": "특약",
      "node_type": "CoverageItem",
      "aliases": ["특약"],
      "planner": {"coverage_topics": ["특약"]}
    },
    {
      "concept_id": "cov.manual_therapy",
      "canonical_name": "도수치료",
      "node_type": "CoverageItem",
      "aliases": ["도수치료", "도수"],
      "planner": {"coverage_topics": ["도수치료"]}
    },
    {
      "concept_id": "cov.shockwave_therapy",
      "canonical_name": "체외충격파치료",
      "node_type": "CoverageItem",
      "aliases": ["체외충격파치료", "체외충격파"],
      "candidate_aliases": ["체충파", "체외충격", "충격파치료"],
      "planner": {"coverage_topics": ["체외충격파치료"]}
    },
    {
      "concept_id": "cov.prolotherapy",
      "canonical_name": "증식치료",
      "node_type": "CoverageItem",
      "aliases": ["증식치료"],
      "planner": {"coverage_topics": ["증식치료"]}
    },
    {
      "concept_id": "cov.nonpay_injection",
      "canonical_name": "비급여 주사료",
      "node_type": "CoverageItem",
      "aliases": ["비급여 주사료", "비급여 주사", "주사료", "영양제", "영양주사"],
      "planner": {"coverage_topics": ["비급여 주사료"]}
    },
    {
      "concept_id": "cov.mri",
      "canonical_name": "MRI",
      "node_type": "CoverageItem",
      "aliases": ["MRI"],
      "candidate_aliases": ["엠알아이", "엠알 아이"],
      "planner": {"coverage_topics": ["MRI"]}
    },
    {
      "concept_id": "cov.mra",
      "canonical_name": "MRA",
      "node_type": "CoverageItem",
      "aliases": ["MRA"],
      "candidate_aliases": ["엠알에이", "엠알 에이"],
      "planner": {"coverage_topics": ["MRA"]}
    },
    {
      "concept_id": "cov.magnetic_resonance",
      "canonical_name": "자기공명영상진단",
      "node_type": "CoverageItem",
      "aliases": ["자기공명영상진단", "자기공명영상"],
      "candidate_aliases": ["자기공명", "자기 공명"],
      "planner": {"coverage_topics": ["자기공명영상진단"]}
    },
    {
      "concept_id": "cov.three_major_nonpay",
      "canonical_name": "3대비급여",
      "node_type": "CoverageItem",
      "aliases": ["3대비급여", "3대 비급여", "세대비급여"],
      "planner": {"coverage_topics": ["3대비급여"]},
      "retrieval": {
        "expansion_rules": [
          {
            "normalized_contains_any": ["3대비급여"],
            "context_any": ["항목", "무엇", "해당"],
            "expansion_terms": ["도수치료", "체외충격파치료", "증식치료", "주사료", "자기공명영상진단", "MRI", "MRA", "용어 정의"]
          }
        ]
      }
    },
    {
      "concept_id": "cov.superior_room_difference",
      "canonical_name": "상급병실료 차액",
      "node_type": "CoverageItem",
      "aliases": ["상급병실료 차액", "상급병실", "병실료 차액"],
      "candidate_aliases": ["병실차액", "상급병실차액", "상급 병실 차액"],
      "planner": {"coverage_topics": ["상급병실료 차액"], "conditions": ["상급병실료 차액"]}
    },
    {
      "concept_id": "cov.health_insurance_not_applied",
      "canonical_name": "건강보험 미적용",
      "node_type": "CoverageItem",
      "aliases": ["건강보험 미적용", "건보 미적용", "급여 미적용"],
      "candidate_aliases": ["건보 안됨", "건보 제외", "건강보험 안됨"],
      "planner": {"coverage_topics": ["건강보험 미적용"], "conditions": ["건강보험 미적용"]}
    },
    {
      "concept_id": "cov.auto_insurance",
      "canonical_name": "자동차보험",
      "node_type": "CoverageItem",
      "aliases": ["자동차보험", "자동차 보험", "교통사고", "차 사고"],
      "planner": {"coverage_topics": ["자동차보험"]},
      "retrieval": {
        "expansion_rules": [
          {
            "match_any": ["교통사고", "자동차사고", "차량사고", "차 사고"],
            "expansion_terms": ["상해급여", "상해비급여", "보장개시일", "자동차보험", "산재보험", "본인부담의료비", "보험금을 지급하지 않는 사유"]
          }
        ]
      }
    },
    {
      "concept_id": "cov.workers_compensation",
      "canonical_name": "산재보험",
      "node_type": "CoverageItem",
      "aliases": ["산재보험", "산재", "산업재해"],
      "planner": {"coverage_topics": ["산재보험"]}
    },
    {
      "concept_id": "cov.health_check",
      "canonical_name": "건강검진",
      "node_type": "CoverageItem",
      "aliases": ["건강검진", "검진 목적", "단순 건강검진"],
      "planner": {"coverage_topics": ["건강검진"], "conditions": ["예방 목적"]}
    },
    {
      "concept_id": "cond.cosmetic_purpose",
      "canonical_name": "미용 목적",
      "node_type": "ClaimCondition",
      "aliases": ["미용 목적", "미용", "성형 목적"],
      "planner": {"coverage_topics": ["미용 목적"], "conditions": ["미용 목적"]}
    },
    {
      "concept_id": "cond.treatment_purpose",
      "canonical_name": "치료 목적",
      "node_type": "ClaimCondition",
      "aliases": ["치료 목적", "치료목적"],
      "planner": {"conditions": ["치료 목적"]}
    },
    {
      "concept_id": "cond.congenital",
      "canonical_name": "선천성",
      "node_type": "ClaimCondition",
      "aliases": ["선천성"],
      "planner": {"conditions": ["선천성"]}
    },
    {
      "concept_id": "cond.preexisting",
      "canonical_name": "기왕증",
      "node_type": "ClaimCondition",
      "aliases": ["기왕증", "기왕력"],
      "planner": {"conditions": ["기왕증"]}
    },
    {
      "concept_id": "cond.preventive_purpose",
      "canonical_name": "예방 목적",
      "node_type": "ClaimCondition",
      "aliases": ["예방 목적", "예방목적", "검진 목적", "건강검진", "이상 소견 없이"],
      "planner": {"conditions": ["예방 목적"]}
    },
    {
      "concept_id": "cond.complication",
      "canonical_name": "합병증",
      "node_type": "ComplicationConcept",
      "aliases": ["합병증"],
      "planner": {"conditions": ["합병증"], "intents": ["complication_policy_lookup"]}
    },
    {
      "concept_id": "cond.complication_treatment",
      "canonical_name": "합병증 치료",
      "node_type": "ComplicationConcept",
      "aliases": ["합병증 치료"],
      "planner": {"coverage_topics": ["합병증 치료"], "conditions": ["합병증"], "intents": ["complication_policy_lookup"]}
    },
    {
      "concept_id": "cond.side_effect",
      "canonical_name": "부작용",
      "node_type": "ComplicationConcept",
      "aliases": ["부작용"],
      "planner": {"conditions": ["부작용"], "intents": ["complication_policy_lookup"]}
    },
    {
      "concept_id": "cond.sequela",
      "canonical_name": "후유증",
      "node_type": "ComplicationConcept",
      "aliases": ["후유증"],
      "planner": {"conditions": ["후유증"], "intents": ["complication_policy_lookup"]}
    },
    {
      "concept_id": "cond.inflammation",
      "canonical_name": "염증",
      "node_type": "ClaimCondition",
      "aliases": ["염증"],
      "planner": {"conditions": ["염증"]}
    },
    {
      "concept_id": "cond.other_insurance_payment",
      "canonical_name": "타 보험 보상",
      "node_type": "ClaimCondition",
      "aliases": ["자동차보험", "산재보험", "이미 보상", "타 보험", "다른 보험"],
      "planner": {"conditions": ["타 보험 보상"]}
    },
    {
      "concept_id": "cond.motorcycle_riding",
      "canonical_name": "이륜자동차 운전/탑승",
      "node_type": "ClaimCondition",
      "aliases": ["이륜자동차", "오토바이", "원동기", "스쿠터"],
      "planner": {
        "conditions": ["이륜자동차 운전/탑승"],
        "intents": ["claim_condition_lookup", "session_claim_path_review"]
      },
      "retrieval": {
        "expansion_rules": [
          {
            "match_any": ["이륜자동차", "오토바이", "원동기", "스쿠터"],
            "expansion_terms": ["이륜자동차 부담보 특별약관", "보험금을 지급하지 않는 사유", "상해", "탑승", "운전", "알릴 의무", "통지"]
          }
        ]
      },
      "properties": {
        "review_actions": ["고지/통지의무 확인", "특약 가입 여부 확인"]
      }
    },
    {
      "concept_id": "cond.drunk_injury",
      "canonical_name": "음주 후 상해",
      "node_type": "ClaimCondition",
      "aliases": ["음주", "만취", "술"],
      "planner": {"conditions": ["음주 후 상해"]},
      "retrieval": {
        "expansion_rules": [
          {
            "match_any": ["음주", "만취", "술"],
            "context_any": ["사고", "상해", "다쳤", "부상"],
            "expansion_terms": ["보험금을 지급하지 않는 사유", "면책", "고의", "중대한 과실", "상해"]
          }
        ]
      }
    },
    {
      "concept_id": "cond.insufficient_evidence",
      "canonical_name": "증빙 부족",
      "node_type": "ClaimCondition",
      "aliases": ["서류 없이", "세부내역서 없이", "영수증만", "증빙 부족"],
      "planner": {"conditions": ["증빙 부족"]}
    },
    {
      "concept_id": "cond.outpatient",
      "canonical_name": "통원",
      "node_type": "VisitContext",
      "aliases": ["통원"],
      "planner": {"conditions": ["통원"]}
    },
    {
      "concept_id": "cond.hospitalization",
      "canonical_name": "입원",
      "node_type": "VisitContext",
      "aliases": ["입원"],
      "planner": {"conditions": ["입원"]}
    },
    {
      "concept_id": "cond.additional_treatment",
      "canonical_name": "추가 치료",
      "node_type": "ClaimCondition",
      "aliases": ["추가 치료", "추후 치료"],
      "planner": {"conditions": ["추가 치료"]}
    },
    {
      "concept_id": "cond.rider_membership_check",
      "canonical_name": "특약 가입 여부 확인",
      "node_type": "ClaimCondition",
      "aliases": ["특약 가입 여부", "특약 가입", "특약이 있는지"],
      "candidate_aliases": ["특약 확인", "특약 여부", "가입특약"],
      "planner": {"conditions": ["특약 가입 여부 확인"]}
    },
    {
      "concept_id": "cond.detail_statement_check",
      "canonical_name": "세부내역서 확인 필요",
      "node_type": "ClaimCondition",
      "aliases": ["세부내역서"],
      "planner": {"conditions": ["세부내역서 확인 필요"]}
    },
    {
      "concept_id": "cond.diagnosis_certificate_check",
      "canonical_name": "진단서 확인 필요",
      "node_type": "ClaimCondition",
      "aliases": ["진단서"],
      "planner": {"conditions": ["진단서 확인 필요"]}
    },
    {
      "concept_id": "cond.diagnosis_code_check",
      "canonical_name": "진단코드 일치 확인",
      "node_type": "ClaimCondition",
      "aliases": ["진단코드"],
      "planner": {"conditions": ["진단코드 일치 확인"]}
    },
    {
      "concept_id": "cond.treatment_purpose_check",
      "canonical_name": "치료 목적 확인",
      "node_type": "ClaimCondition",
      "aliases": ["치료 목적", "목적"],
      "planner": {"conditions": ["치료 목적 확인"]}
    },
    {
      "concept_id": "evidence.receipt",
      "canonical_name": "영수증",